<?xml version="1.0" encoding="UTF-8"?>
<tns:root xmlns:tns="http://aeneas.bsc.es/ReferenceModel"
          xmlns:xsi="http://www.w3.org/2001/XMLSchema-instance"
          xmlns:cmt="http://aeneas.bsc.es/CommonTypes"
          xsi:schemaLocation="http://aeneas.bsc.es/ReferenceModel ../../main/resources/ReferenceModel.xsd">
    <tns:entity name="frame" >
        <tns:keyType>Int32Type</tns:keyType>
        <tns:value>
            <tns:nodeValue>
                <tns:entity name="natoms" >
                    <tns:keyValue>natoms</tns:keyValue>
                    <tns:value>
                        <tns:simpleValue>
                            <cmt:standardType>AnyType</cmt:standardType>
                        </tns:simpleValue>
                    </tns:value>
                </tns:entity>
                <tns:entity name="step" >
                    <tns:keyValue>step</tns:keyValue>
                    <tns:value>
                        <tns:simpleValue> 
                            <cmt:standardType>Int32Type</cmt:standardType>
                        </tns:simpleValue>
                    </tns:value>
                </tns:entity>
                <tns:entity name="time" >
                    <tns:keyValue>time</tns:keyValue>
                    <tns:value>
                        <tns:simpleValue> 
                            <cmt:standardType>LongType</cmt:standardType>
                        </tns:simpleValue>
                    </tns:value>
                </tns:entity>
                <tns:entity name="prec" >
                    <tns:keyValue>prec</tns:keyValue>
                    <tns:value>
                        <tns:simpleValue> 
                            <cmt:standardType>Int32Type</cmt:standardType>
                        </tns:simpleValue>
                    </tns:value>
                </tns:entity>
                <tns:entity name="box" >
                    <tns:keyValue>box</tns:keyValue>
                    <tns:value>
                        <tns:simpleValue>
	<cmt:customType>es.bsc.aeneas.model.marshalling.BoxType</cmt:customType>
                        </tns:simpleValue>
                    </tns:value>
                </tns:entity>	
                <tns:entity name="points" >
                    <tns:keyValue>points</tns:keyValue>
                    <tns:value>
                        <tns:nodeValue>
                            <tns:entity name="index">
                                <tns:keyType>Int32Type</tns:keyType>
                                <tns:value>
                                    <tns:simpleValue>
                                        <cmt:customType>es.bsc.aeneas.model.marshalling.PointType</cmt:customType>
                                        </tns:simpleValue>
                                </tns:value>
                            </tns:entity>
                        </tns:nodeValue>
                    </tns:value>
                </tns:entity>
            </tns:nodeValue>
        </tns:value>
    </tns:entity>
</tns:root>