<?xml version="1.0" encoding="UTF-8"?>
<tns:root xmlns:tns="http://cassamdrabm.bsc.es/ReferenceModel"
          xmlns:xsi="http://www.w3.org/2001/XMLSchema-instance"
          xmlns:cmt="http://cassamdrabm.bsc.es/CommonTypes"
          xsi:schemaLocation="http://cassamdrabm.bsc.es/ReferenceModel    ../../../../model/src/main/resources/ReferenceModel.xsd
http://cassamdrabm.bsc.es/CommonTypes ../../../../model/src/main/resources/CommonTypes.xsd">
    <tns:entity name="workspace" >
        <tns:keyType>UTF8Type</tns:keyType>
        <tns:value>
            <tns:nodeValue>
                <tns:entity name="desc" >
                    <tns:keyType>UTF8Type</tns:keyType>
                    <tns:value>
                        <tns:simpleValue>
                            <cmt:standardType>UTF8Type</cmt:standardType>
                        </tns:simpleValue>
                    </tns:value>
                </tns:entity>
                <tns:entity name="creationTime" >
                    <tns:keyType>UTF8Type</tns:keyType>
                    <tns:value>
                        <tns:simpleValue>
                            <cmt:standardType>LongType</cmt:standardType>
                        </tns:simpleValue>
                    </tns:value>
                </tns:entity>
                <tns:entity name="modificationTime" >
                    <tns:keyType>UTF8Type</tns:keyType>
                    <tns:value>
                        <tns:simpleValue>
                            <cmt:standardType>LongType</cmt:standardType>
                        </tns:simpleValue>
                    </tns:value>
                </tns:entity>
                
                <tns:entity name="sets" >
                    <tns:keyValue>sets</tns:keyValue>                    
                    <tns:value>
                        <tns:nodeValue>
                            <tns:entity name="sname" >
                                <tns:keyType>UTF8Type</tns:keyType>  
                                <tns:value>
                                    <tns:simpleValue>
                                        <!--JSON encoded data -->
                                        <cmt:standardType>UTF8Type</cmt:standardType>
                                    </tns:simpleValue>
                                </tns:value>
                            </tns:entity>
                    
                        </tns:nodeValue>
                    </tns:value>
                </tns:entity>
                
                <tns:entity name="snippets" >
                    <tns:keyValue>snippets</tns:keyValue>                    
                    <tns:value>
                        <tns:nodeValue>
                            <tns:entity name="sname" >
                                <tns:keyType>UTF8Type</tns:keyType>  
                                <tns:value>
                                    <tns:nodeValue>
                                        <tns:entity name="tag">
                                            <tns:keyValue>tag</tns:keyValue>
                                            <tns:value>
                                                <tns:simpleValue>
                                                    <cmt:standardType>UTF8Type</cmt:standardType>
                                                </tns:simpleValue>
                                            </tns:value>
                                        </tns:entity>
                                        <tns:entity name="data">
                                            <tns:keyValue>data</tns:keyValue>
                                            <tns:value>
                                                <tns:nodeValue>
                                                    <tns:entity name="time">
                                                        <tns:keyType>LongType</tns:keyType>
                                                        <tns:simpleValue>
                                                            <!--JSON encoded data -->
                                                            <cmt:standardType>UTF8Type</cmt:standardType>
                                                        </tns:simpleValue>
                                                    </tns:entity>
                                            </tns:value>
                                        </tns:entity>
                                    </tns:nodeValue>                             
                                </tns:value>
                            </tns:entity>
                        </tns:nodeValue>                
                    </tns:value>
                </tns:entity> 
            </tns:nodeValue>
        </tns:value>
    </tns:entity>
</tns:root>